{
  "$schema": "https://raw.githubusercontent.com/gruncellka/porto-data/refs/heads/main/porto_data/schemas/graph.schema.json",
  "file_type": "graph",
  "unit": {
    "weight": "g",
    "dimension": "mm",
    "price": "cents",
    "currency": "CHF"
  },
  "dependencies": {
    "products": {
      "file": "products.json",
      "depends_on": [
        "zones.json",
        "weights.json",
        "formats/envelopes.json",
        "services.json",
        "features.json",
        "marks.json"
      ],
      "description": "Products require zones, weight tiers, canonical envelope format ids, services, features, and mark profiles"
    },
    "services": {
      "file": "services.json",
      "depends_on": [
        "features.json"
      ],
      "description": "Services require features"
    },
    "product_prices": {
      "file": "prices/products.json",
      "depends_on": [
        "products.json",
        "zones.json",
        "weights.json"
      ],
      "description": "Base postage grid; file providers/<id>/prices/products.json (file_type product_prices)"
    },
    "service_prices": {
      "file": "prices/services.json",
      "depends_on": [
        "products.json",
        "services.json",
        "zones.json",
        "weights.json"
      ],
      "description": "Service surcharge amounts; file providers/<id>/prices/services.json (file_type service_prices)"
    },
    "zones": {
      "file": "zones.json",
      "depends_on": [
        "policy/restrictions.json"
      ],
      "description": "Zones may have restricted destinations"
    },
    "weights": {
      "file": "weights.json",
      "depends_on": [],
      "description": "Weight brackets (tier ids) are standalone definitions"
    },
    "envelopes": {
      "file": "formats/envelopes.json",
      "depends_on": [],
      "description": "Global envelope id catalog: physical front size (mm); international baseline (e.g. ISO 269); file formats/envelopes.json"
    },
    "envelope_layouts": {
      "file": "formats/layouts.json",
      "depends_on": [
        "formats/envelopes.json"
      ],
      "description": "Jurisdiction-keyed print/window layout (DE/CH/FR); file formats/layouts.json"
    },
    "address_forms": {
      "file": "formats/addresses.json",
      "depends_on": [
        "policy/jurisdictions.json",
        "formats/layouts.json"
      ],
      "description": "Jurisdiction-keyed address forms (DE/CH/FR/UA); layout-aligned standards where layouts exist; file formats/addresses.json"
    },
    "jurisdictions": {
      "file": "policy/jurisdictions.json",
      "depends_on": [],
      "description": "UN/EU membership sets for restriction framework jurisdiction resolution"
    },
    "markets": {
      "file": "policy/markets.json",
      "depends_on": [],
      "description": "Country-level currency, VAT, and international quote currencies for providers.json country"
    },
    "restrictions": {
      "file": "policy/restrictions.json",
      "depends_on": [
        "policy/jurisdictions.json",
        "zones.json",
        "products.json"
      ],
      "description": "Global destination restrictions (bundled as policy/restrictions.json); optional cross-reference to zones and products"
    },
    "limits": {
      "file": "limits.json",
      "depends_on": [
        "policy/restrictions.json"
      ],
      "description": "Provider operational limits extend global restrictions after load"
    },
    "features": {
      "file": "features.json",
      "depends_on": [],
      "description": "Features are standalone"
    },
    "marks": {
      "file": "marks.json",
      "depends_on": [],
      "description": "Franking profile catalog: profiles[] (sizes); resolution in graph.edges.marks"
    },
    "rules": {
      "file": "rules.json",
      "depends_on": [
        "graph.json",
        "products.json",
        "services.json",
        "zones.json",
        "prices/services.json"
      ],
      "description": "Conditional letter policies (e.g. thickness surcharge); SDK evaluates after base resolution"
    }
  },
  "services": [
    "a_mail_plus"
  ],
  "edges": {
    "products": {
      "a_post_standardbrief": {
        "zones": [
          "domestic"
        ],
        "weight_tiers": [
          "W0020",
          "W0050",
          "W0100"
        ]
      },
      "a_post_grossbrief": {
        "zones": [
          "domestic"
        ],
        "weight_tiers": [
          "W0250",
          "W0500",
          "W1000"
        ]
      },
      "b_post_standardbrief": {
        "zones": [
          "domestic"
        ],
        "weight_tiers": [
          "W0020",
          "W0050",
          "W0100"
        ]
      },
      "b_post_grossbrief": {
        "zones": [
          "domestic"
        ],
        "weight_tiers": [
          "W0250",
          "W0500",
          "W1000"
        ]
      },
      "international_standardbrief": {
        "zones": [
          "zone_1_eu",
          "world"
        ],
        "weight_tiers": [
          "W0020",
          "W0050",
          "W0100"
        ]
      },
      "international_grossbrief": {
        "zones": [
          "zone_1_eu",
          "world"
        ],
        "weight_tiers": [
          "W0250",
          "W0500"
        ]
      },
      "international_maxibrief": {
        "zones": [
          "zone_1_eu",
          "world"
        ],
        "weight_tiers": [
          "W0500",
          "W1000",
          "W2000"
        ]
      }
    },
    "marks": {
      "domestic": {
        "profile": "domestic"
      },
      "zone_1_eu": {
        "profile": "international"
      },
      "world": {
        "profile": "international"
      }
    },
    "wire": {
      "webstamp": {
        "a_post_standardbrief": {
          "domestic": {
            "base": "a_post_standardbrief"
          }
        },
        "a_post_grossbrief": {
          "domestic": {
            "base": "a_post_grossbrief"
          }
        },
        "b_post_standardbrief": {
          "domestic": {
            "base": "b_post_standardbrief"
          }
        },
        "b_post_grossbrief": {
          "domestic": {
            "base": "b_post_grossbrief"
          }
        },
        "international_standardbrief": {
          "zone_1_eu": {
            "base": "international_standardbrief"
          },
          "world": {
            "base": "international_standardbrief"
          }
        },
        "international_grossbrief": {
          "zone_1_eu": {
            "base": "international_grossbrief"
          },
          "world": {
            "base": "international_grossbrief"
          }
        },
        "international_maxibrief": {
          "zone_1_eu": {
            "base": "international_maxibrief"
          },
          "world": {
            "base": "international_maxibrief"
          }
        }
      }
    }
  },
  "strategy": "speed"
}
