{
  "$schema": "https://raw.githubusercontent.com/gruncellka/porto-data/refs/heads/main/porto_data/schemas/graph.schema.json",
  "file_type": "graph",
  "unit": {
    "weight": "g",
    "dimension": "mm",
    "price": "cents",
    "currency": "EUR"
  },
  "dependencies": {
    "products": {
      "file": "products.json",
      "depends_on": [
        "zones.json",
        "weights.json",
        "formats/envelopes.json",
        "services.json",
        "features.json",
        "marks.json"
      ],
      "description": "Products require zones, weight tiers, canonical envelope format ids, services, features, and mark profiles"
    },
    "services": {
      "file": "services.json",
      "depends_on": [
        "features.json"
      ],
      "description": "Services require features and price information"
    },
    "product_prices": {
      "file": "prices/products.json",
      "depends_on": [
        "products.json",
        "zones.json",
        "weights.json"
      ],
      "description": "Base postage grid (product_id × zone × weight_tier); file providers/<id>/prices/products.json (file_type product_prices)"
    },
    "service_prices": {
      "file": "prices/services.json",
      "depends_on": [
        "products.json",
        "services.json",
        "zones.json",
        "weights.json"
      ],
      "description": "Service surcharge amounts; file providers/<id>/prices/services.json (file_type service_prices)"
    },
    "zones": {
      "file": "zones.json",
      "depends_on": [
        "policy/restrictions.json"
      ],
      "description": "Zones may have restricted destinations"
    },
    "weights": {
      "file": "weights.json",
      "depends_on": [],
      "description": "Weight brackets (tier ids) are standalone definitions"
    },
    "envelopes": {
      "file": "formats/envelopes.json",
      "depends_on": [],
      "description": "Global envelope id catalog: physical front size (mm); international baseline (e.g. ISO 269); file formats/envelopes.json"
    },
    "envelope_layouts": {
      "file": "formats/layouts.json",
      "depends_on": [
        "formats/envelopes.json"
      ],
      "description": "Jurisdiction-keyed print/window layout (DE/CH/FR); file formats/layouts.json"
    },
    "address_forms": {
      "file": "formats/addresses.json",
      "depends_on": [
        "policy/jurisdictions.json",
        "formats/layouts.json"
      ],
      "description": "Jurisdiction-keyed address forms (DE/CH/FR/UA); layout-aligned standards where layouts exist; file formats/addresses.json"
    },
    "jurisdictions": {
      "file": "policy/jurisdictions.json",
      "depends_on": [],
      "description": "UN/EU membership sets for restriction framework jurisdiction resolution"
    },
    "markets": {
      "file": "policy/markets.json",
      "depends_on": [],
      "description": "Country-level currency, VAT, and international quote currencies for providers.json country"
    },
    "restrictions": {
      "file": "policy/restrictions.json",
      "depends_on": [
        "policy/jurisdictions.json",
        "zones.json",
        "products.json"
      ],
      "description": "Global destination restrictions (bundled as policy/restrictions.json); optional cross-reference to zones and products"
    },
    "limits": {
      "file": "limits.json",
      "depends_on": [
        "policy/restrictions.json"
      ],
      "description": "Provider operational limits extend global restrictions after load"
    },
    "features": {
      "file": "features.json",
      "depends_on": [],
      "description": "Features are standalone definitions referenced by services"
    },
    "marks": {
      "file": "marks.json",
      "depends_on": [],
      "description": "Franking profile catalog: profiles[] (sizes); resolution in graph.edges.marks"
    },
    "execution": {
      "file": "execution.json",
      "depends_on": [],
      "description": "Execution manifest (wire + billing/execution capability tokens); wire codes stay in edges.wire"
    }
  },
  "services": [
    "einschreiben",
    "einschreiben_einwurf",
    "einschreiben_rueckschein",
    "zusatzversicherung"
  ],
  "edges": {
    "products": {
      "standardbrief": {
        "zones": [
          "domestic",
          "zone_1_eu",
          "zone_2_europe",
          "world"
        ],
        "weight_tiers": [
          "W0020"
        ]
      },
      "kompaktbrief": {
        "zones": [
          "domestic",
          "zone_1_eu",
          "zone_2_europe",
          "world"
        ],
        "weight_tiers": [
          "W0050"
        ]
      },
      "grossbrief": {
        "zones": [
          "domestic",
          "zone_1_eu",
          "zone_2_europe",
          "world"
        ],
        "weight_tiers": [
          "W0500"
        ]
      },
      "maxibrief": {
        "zones": [
          "domestic",
          "zone_1_eu",
          "zone_2_europe",
          "world"
        ],
        "weight_tiers": [
          "W1000"
        ]
      },
      "maxibrief_ausland": {
        "zones": [
          "zone_1_eu",
          "zone_2_europe",
          "world"
        ],
        "weight_tiers": [
          "W2000"
        ]
      }
    },
    "marks": {
      "domestic": {
        "profile": "domestic",
        "services": {
          "einschreiben": "registered",
          "einschreiben_einwurf": "registered",
          "einschreiben_rueckschein": "registered"
        }
      },
      "zone_1_eu": {
        "profile": "international",
        "services": {
          "einschreiben": "registered_international"
        }
      },
      "zone_2_europe": {
        "profile": "international",
        "services": {
          "einschreiben": "registered_international"
        }
      },
      "world": {
        "profile": "international",
        "services": {
          "einschreiben": "registered_international"
        }
      }
    },
    "wire": {
      "internetmarke": {
        "standardbrief": {
          "domestic": {
            "base": 1,
            "services": {
              "einschreiben": 1007,
              "einschreiben_einwurf": 1002,
              "einschreiben_rueckschein": 1008
            }
          },
          "zone_1_eu": {
            "base": 10001,
            "services": {
              "einschreiben": 11006
            }
          },
          "zone_2_europe": {
            "base": 10001,
            "services": {
              "einschreiben": 11006
            }
          },
          "world": {
            "base": 10001,
            "services": {
              "einschreiben": 11006
            }
          }
        },
        "kompaktbrief": {
          "domestic": {
            "base": 11,
            "services": {
              "einschreiben": 1017,
              "einschreiben_einwurf": 1012,
              "einschreiben_rueckschein": 1018
            }
          },
          "zone_1_eu": {
            "base": 10011,
            "services": {
              "einschreiben": 11016
            }
          },
          "zone_2_europe": {
            "base": 10011,
            "services": {
              "einschreiben": 11016
            }
          },
          "world": {
            "base": 10011,
            "services": {
              "einschreiben": 11016
            }
          }
        },
        "grossbrief": {
          "domestic": {
            "base": 21,
            "services": {
              "einschreiben": 1027,
              "einschreiben_einwurf": 1022,
              "einschreiben_rueckschein": 1028
            }
          },
          "zone_1_eu": {
            "base": 10051,
            "services": {
              "einschreiben": 11056
            }
          },
          "zone_2_europe": {
            "base": 10051,
            "services": {
              "einschreiben": 11056
            }
          },
          "world": {
            "base": 10051,
            "services": {
              "einschreiben": 11056
            }
          }
        },
        "maxibrief": {
          "domestic": {
            "base": 31,
            "services": {
              "einschreiben": 1037,
              "einschreiben_einwurf": 1032,
              "einschreiben_rueckschein": 1038
            }
          },
          "zone_1_eu": {
            "base": 10071,
            "services": {
              "einschreiben": 11076
            }
          },
          "zone_2_europe": {
            "base": 10071,
            "services": {
              "einschreiben": 11076
            }
          },
          "world": {
            "base": 10071,
            "services": {
              "einschreiben": 11076
            }
          }
        },
        "maxibrief_ausland": {
          "zone_1_eu": {
            "base": 10091,
            "services": {
              "einschreiben": 11096
            }
          },
          "zone_2_europe": {
            "base": 10091,
            "services": {
              "einschreiben": 11096
            }
          },
          "world": {
            "base": 10091,
            "services": {
              "einschreiben": 11096
            }
          }
        }
      }
    }
  },
  "strategy": "service"
}
