{
  "$schema": "https://raw.githubusercontent.com/gruncellka/porto-data/refs/heads/main/porto_data/schemas/graph.schema.json",
  "file_type": "graph",
  "unit": {
    "weight": "g",
    "dimension": "mm",
    "price": "cents",
    "currency": "UAH"
  },
  "dependencies": {
    "products": {
      "file": "products.json",
      "depends_on": [
        "zones.json",
        "weights.json",
        "formats/envelopes.json",
        "services.json",
        "features.json",
        "marks.json"
      ],
      "description": "Postal product catalog"
    },
    "services": {
      "file": "services.json",
      "depends_on": [
        "features.json"
      ],
      "description": "Optional add-on services"
    },
    "product_prices": {
      "file": "prices/products.json",
      "depends_on": [
        "products.json",
        "zones.json",
        "weights.json"
      ],
      "description": "Base postage rates by product, zone, and weight tier"
    },
    "service_prices": {
      "file": "prices/services.json",
      "depends_on": [
        "products.json",
        "services.json",
        "zones.json",
        "weights.json"
      ],
      "description": "Add-on service surcharge rates"
    },
    "zones": {
      "file": "zones.json",
      "depends_on": [
        "policy/restrictions.json"
      ],
      "description": "Destination zones and included country codes"
    },
    "weights": {
      "file": "weights.json",
      "depends_on": [],
      "description": "Weight tier definitions"
    },
    "envelopes": {
      "file": "formats/envelopes.json",
      "depends_on": [],
      "description": "Standard envelope formats and dimensions"
    },
    "envelope_layouts": {
      "file": "formats/layouts.json",
      "depends_on": [
        "formats/envelopes.json"
      ],
      "description": "Print and window layout standards by jurisdiction"
    },
    "address_forms": {
      "file": "formats/addresses.json",
      "depends_on": [
        "policy/jurisdictions.json",
        "formats/layouts.json"
      ],
      "description": "Postal address formatting rules by jurisdiction"
    },
    "jurisdictions": {
      "file": "policy/jurisdictions.json",
      "depends_on": [],
      "description": "Country and regional jurisdiction reference"
    },
    "markets": {
      "file": "policy/markets.json",
      "depends_on": [],
      "description": "Currency, VAT, and postal working-day calendar by country"
    },
    "restrictions": {
      "file": "policy/restrictions.json",
      "depends_on": [
        "policy/jurisdictions.json",
        "zones.json",
        "products.json"
      ],
      "description": "Destination mailing restrictions by country and region"
    },
    "marks": {
      "file": "marks.json",
      "depends_on": [],
      "description": "Franking mark profiles and dimensions"
    },
    "features": {
      "file": "features.json",
      "depends_on": [],
      "description": "Service capability features"
    }
  },
  "services": [
    "paperove_povidomlennia_vruchennia",
    "elektronne_povidomlennia_vruchennia",
    "mizhnarodne_zareiestrovane"
  ],
  "edges": {
    "products": {
      "lyst_standartnyi": {
        "zones": [
          "domestic",
          "world"
        ],
        "weight_tiers": [
          "W0050",
          "W0250",
          "W1000",
          "W2000"
        ]
      },
      "dokument": {
        "zones": [
          "domestic"
        ],
        "weight_tiers": [
          "W0050",
          "W0250",
          "W1000"
        ]
      }
    },
    "marks": {
      "domestic": {
        "profile": "domestic"
      },
      "world": {
        "profile": "domestic"
      }
    },
    "wire": {
      "ukrposhta_ecom": {
        "lyst_standartnyi": {
          "domestic": {
            "base": "letter"
          },
          "world": {
            "base": "letter"
          }
        },
        "dokument": {
          "domestic": {
            "base": "document"
          }
        }
      }
    }
  },
  "strategy": "min"
}
