{
  "$schema": "https://raw.githubusercontent.com/gruncellka/porto-data/refs/heads/main/porto_data/schemas/graph.schema.json",
  "file_type": "graph",
  "unit": {
    "weight": "g",
    "dimension": "mm",
    "price": "cents",
    "currency": "EUR"
  },
  "dependencies": {
    "products": {
      "file": "products.json",
      "depends_on": [
        "zones.json",
        "weights.json",
        "formats/envelopes.json",
        "services.json",
        "features.json",
        "marks.json"
      ],
      "description": "Products require zones, weight tiers, canonical envelope format ids, services, features, and mark profiles"
    },
    "services": {
      "file": "services.json",
      "depends_on": [
        "features.json"
      ],
      "description": "Services require features"
    },
    "product_prices": {
      "file": "prices/products.json",
      "depends_on": [
        "products.json",
        "zones.json",
        "weights.json"
      ],
      "description": "Base postage grid; file providers/<id>/prices/products.json (file_type product_prices)"
    },
    "service_prices": {
      "file": "prices/services.json",
      "depends_on": [
        "products.json",
        "services.json",
        "zones.json",
        "weights.json"
      ],
      "description": "Service surcharge amounts; file providers/<id>/prices/services.json (file_type service_prices)"
    },
    "zones": {
      "file": "zones.json",
      "depends_on": [
        "policy/restrictions.json"
      ],
      "description": "Zones may have restricted destinations"
    },
    "weights": {
      "file": "weights.json",
      "depends_on": [],
      "description": "Weight brackets (tier ids) are standalone definitions"
    },
    "envelopes": {
      "file": "formats/envelopes.json",
      "depends_on": [],
      "description": "Global envelope id catalog: physical front size (mm); international baseline (e.g. ISO 269); file formats/envelopes.json"
    },
    "envelope_layouts": {
      "file": "formats/layouts.json",
      "depends_on": [
        "formats/envelopes.json"
      ],
      "description": "Jurisdiction-keyed print/window layout (DE/CH/FR); file formats/layouts.json"
    },
    "address_forms": {
      "file": "formats/addresses.json",
      "depends_on": [
        "policy/jurisdictions.json",
        "formats/layouts.json"
      ],
      "description": "Jurisdiction-keyed address forms (DE/CH/FR/UA); layout-aligned standards where layouts exist; file formats/addresses.json"
    },
    "jurisdictions": {
      "file": "policy/jurisdictions.json",
      "depends_on": [],
      "description": "UN/EU membership sets for restriction framework jurisdiction resolution"
    },
    "markets": {
      "file": "policy/markets.json",
      "depends_on": [],
      "description": "Country-level currency, VAT, and international quote currencies for providers.json country"
    },
    "restrictions": {
      "file": "policy/restrictions.json",
      "depends_on": [
        "policy/jurisdictions.json",
        "zones.json",
        "products.json"
      ],
      "description": "Global destination restrictions (bundled as policy/restrictions.json); optional cross-reference to zones and products"
    },
    "features": {
      "file": "features.json",
      "depends_on": [],
      "description": "Features are standalone"
    },
    "marks": {
      "file": "marks.json",
      "depends_on": [],
      "description": "Franking profile catalog: profiles[] (sizes); resolution in graph.edges.marks"
    }
  },
  "services": [
    "option_suivi",
    "avis_de_reception_national",
    "avis_de_reception_international"
  ],
  "edges": {
    "products": {
      "lettre_verte": {
        "zones": [
          "domestic"
        ],
        "weight_tiers": [
          "W0020",
          "W0100",
          "W0250",
          "W0500",
          "W1000",
          "W2000"
        ]
      },
      "lettre_verte_suivie": {
        "zones": [
          "domestic",
          "zone_1_eu",
          "zone_2_europe",
          "world"
        ],
        "weight_tiers": [
          "W0020",
          "W0100",
          "W0250",
          "W0500",
          "W1000",
          "W2000"
        ]
      },
      "lettre_services_plus": {
        "zones": [
          "domestic"
        ],
        "weight_tiers": [
          "W0020",
          "W0100",
          "W0250",
          "W0500",
          "W1000",
          "W2000"
        ]
      },
      "lettre_recommandee_r_un": {
        "zones": [
          "domestic"
        ],
        "weight_tiers": [
          "W0020",
          "W0050",
          "W0100",
          "W0250",
          "W0500",
          "W1000",
          "W2000"
        ]
      },
      "lettre_recommandee_r_deux": {
        "zones": [
          "domestic"
        ],
        "weight_tiers": [
          "W0020",
          "W0050",
          "W0100",
          "W0250",
          "W0500",
          "W1000",
          "W2000"
        ]
      },
      "lettre_recommandee_r_trois": {
        "zones": [
          "domestic"
        ],
        "weight_tiers": [
          "W0020",
          "W0050",
          "W0100",
          "W0250",
          "W0500",
          "W1000",
          "W2000"
        ]
      },
      "lettre_recommandee_internationale_r_un": {
        "zones": [
          "zone_1_eu",
          "zone_2_europe",
          "world"
        ],
        "weight_tiers": [
          "W0020",
          "W0050",
          "W0100",
          "W0250",
          "W0500",
          "W1000",
          "W2000"
        ]
      }
    },
    "marks": {
      "domestic": {
        "profile": "domestic"
      },
      "zone_1_eu": {
        "profile": "international"
      },
      "zone_2_europe": {
        "profile": "international"
      },
      "world": {
        "profile": "international"
      }
    },
    "wire": {
      "mon_timbre_en_ligne": {
        "lettre_verte": {
          "domestic": {
            "base": "lettre_verte"
          }
        },
        "lettre_verte_suivie": {
          "domestic": {
            "base": "lettre_verte_suivie"
          },
          "zone_1_eu": {
            "base": "lettre_verte_suivie"
          },
          "zone_2_europe": {
            "base": "lettre_verte_suivie"
          },
          "world": {
            "base": "lettre_verte_suivie"
          }
        },
        "lettre_services_plus": {
          "domestic": {
            "base": "lettre_services_plus"
          }
        },
        "lettre_recommandee_r_un": {
          "domestic": {
            "base": "lettre_recommandee_r_un"
          }
        },
        "lettre_recommandee_r_deux": {
          "domestic": {
            "base": "lettre_recommandee_r_deux"
          }
        },
        "lettre_recommandee_r_trois": {
          "domestic": {
            "base": "lettre_recommandee_r_trois"
          }
        },
        "lettre_recommandee_internationale_r_un": {
          "zone_1_eu": {
            "base": "lettre_recommandee_internationale_r_un"
          },
          "zone_2_europe": {
            "base": "lettre_recommandee_internationale_r_un"
          },
          "world": {
            "base": "lettre_recommandee_internationale_r_un"
          }
        }
      }
    }
  },
  "strategy": "id"
}
